{
  "schema_version": "0.1",
  "id": "git-scm--git",
  "name": "Git",
  "aliases": [
    "git"
  ],
  "kind": "software",
  "category": "software/devtools/version-control",
  "tags": [
    "version-control",
    "dvcs"
  ],
  "maker": {
    "name": "Git",
    "url": "https://git-scm.com/"
  },
  "identifiers": {
    "mpn": "git",
    "repo_url": "https://github.com/git/git"
  },
  "description": "Git thinks of its data more like a series of snapshots of a miniature filesystem.",
  "specs": {
    "license": {
      "raw": "GPL-2.0",
      "value": "gpl-2.0",
      "source": "c86f70fc51d5db144e1b266500fa164a90eb4516c34515928800828b0f39b9c9",
      "evidence": "GNU GENERAL PUBLIC LICENSE Version 2, June 1991",
      "observed_at": "2026-10-28T20:35:00Z",
      "confidence": 0.6
    },
    "distributed": {
      "raw": "true",
      "value": true,
      "source": "88b6b8e99a4059b695185efd7b888ee4d7f6ff1ba0f5a1ea350ca256826449ee",
      "evidence": "Most operations in Git need only local files and resources to operate -- generally no information is needed from another computer on your network.",
      "observed_at": "2026-10-28T20:35:00Z",
      "confidence": 0.9
    }
  },
  "status": "active",
  "confidence": 0.6,
  "created_at": "2026-10-28T20:33:50.735251Z",
  "updated_at": "2026-10-28T20:33:50.735251Z",
  "last_verified_at": "2026-10-28T20:33:50.735251Z",
  "history": [
    {
      "change_id": "82597f2d-6280-4028-9380-1d9989e7d329",
      "at": "2026-10-28T20:33:50.735251Z",
      "run_id": "run-bootstrap",
      "agent": "pipeline",
      "op": "create",
      "path": "git-scm--git",
      "reason": "verified write"
    }
  ],
  "sources": [
    "88b6b8e99a4059b695185efd7b888ee4d7f6ff1ba0f5a1ea350ca256826449ee",
    "c86f70fc51d5db144e1b266500fa164a90eb4516c34515928800828b0f39b9c9"
  ]
}
